title,description,thumbnail,article_link
هول جديد في حرب غزة ينذر بعصر بلا أخلاق,ترجمة أحمد شافعي في يوم الأربعاء الماضي تلقى بنيامين نتنياهو تصفيقا من أعضاء الكونجرس الأمريكي وهم وقوف بدا أن تلك اللحظة تنذر بطور جديد من حرب غزة لا يتم التسامح فيه مع هذه ,https://www.omandaily.om/theme_omandaily/images/no-image.jpg,https://www.omandaily.om/أفكار-وآراء/na/هول-جديد-في-حرب-غزة-ينذر-بعصر-بلا-أخلاق
محور «الإرهاب» الصهيو-أمريكي!,ماذا نحن فاعلون إذا نفذت الدولة الصهيونية تهديداتها وهاجمت لبنان ودكت مدنه بالصواريخ والقنابل الأمريكية والغربية ثم اجتاحت أراضيه مثلما فعلت مع غزة هل سنبقي أنفسنا خارج الصراع ونك ,https://www.omandaily.om/theme_omandaily/images/no-image.jpg,https://www.omandaily.om/أفكار-وآراء/na/محور-الإرهاب-الصهيو-أمريكي
أسطوريات لبنانية,لو عدنا إلى تاريخ الأدب في العالم لوجدنا أن الكثير من الأمكنة غير الموجودة في الواقع قد تحولت إلى أمكنة أسطورية وأقصد إلى جغرافيا متخيلة لم تكن حاضرة إلا في خيالات مبدعيها هكذ ,https://www.omandaily.om/theme_omandaily/images/no-image.jpg,https://www.omandaily.om/أفكار-وآراء/na/أسطوريات-لبنانية
العشاء الأخير ونهاية الغرب,حرارة القيظ وح م ى كون سائر إلى فساد وقيم إنساني ة تتهاوى وتتساقط وعالم يخطو إلى الفساد والانحلال وأخلاق قالت فيها الأديان وب ن ت صروح ها الفلسفات وتسم ت وات فق على حد ,https://www.omandaily.om/theme_omandaily/images/no-image.jpg,https://www.omandaily.om/أعمدة/na/العشاء-الأخير-ونهاية-الغرب
سردية الصمود الفلسطيني,يسأل المذيع ضيفه الطبيب العائد من غزة هل هنالك أشياء تتذكرها من هناك يقول نعم أفعل الرائحة الزكية التي تشبه المسك من الشهداء يبتسم المذيع لكي لا أقول أنه يضحك ويقول تتذكرها ,https://www.omandaily.om/theme_omandaily/images/no-image.jpg,https://www.omandaily.om/أعمدة/na/سردية-الصمود-الفلسطيني
مناقشة المبادرات والبرامج التنفيذية لتطوير الرعاية الصحية,العمانية ناقشت اللجنة التوجيهية لمتابعة تطوير نموذج الرعاية الصحية اليوم في اجتماعها الأول برئاسة سعادة الدكتور أحمد بن سالم المنظري وكيل وزارة الصحة للتخطيط والتنظيم الصـحي اختص ,https://www.omandaily.om/omandaily/uploads/images/2024/07/30/2731107.jpeg,https://www.omandaily.om/عمان-اليوم/na/مناقشة-المبادرات-والبرامج-التنفيذية-لتطوير-الرعاية-الصحية
منخفض بحر العرب يبدأ تأثيراته على معظم المحافظات,بدأت اليوم تأثيرات امتداد منخفض جوي من بحر العرب على أجواء سلطنة عمان حيث شهدت أجزاء من محافظتي جنوب الشرقية ومسقط هطول أمطار بين الخفيفة والمتوسطة وتدفقا للسحب واعتدالا في درجا ,https://www.omandaily.om/omandaily/uploads/images/2024/07/30/2731103.jpeg,https://www.omandaily.om/عمان-اليوم/na/منخفض-بحر-العرب-يبدأ-تأثيراته-على-معظم-المحافظات
خريجو دبلوم التعليم العام يحددون مسارتهم المستقبلية وفق ميولهم,يحدد الطلبة من خريجي دبلوم التعليم العام بعد انتهاء مرحلة التعليم المدرسي مساراتهم المستقبلية وفق ميولهم واختياراتهم في جوانب العلم والبناء مؤكدين العمل على الارتقاء بمهاراتهم في م ,https://www.omandaily.om/omandaily/uploads/images/2024/07/30/2731102.jpg,https://www.omandaily.om/عمان-اليوم/na/خريجو-دبلوم-التعليم-العام-يحددون-مسارتهم-المستقبلية-وفق-ميولهم
دراسة: انتشار الاكتئاب بين المصابين بأمراض الأمعاء الالتهابية, quot عمان quot توصلت دراسة أجراها باحثون بجامعة السلطان قابوس إلى أن أعراض الاكتئاب منتشرة بين المرضى العمانيين المصابين بأمراض الأمعاء الالتهابية وبينت أن بعض العوامل السريرية ,https://www.omandaily.om/omandaily/uploads/images/2024/07/30/2731101.jpeg,https://www.omandaily.om/عمان-اليوم/na/دراسة-انتشار-الاكتئاب-بين-المصابين-بأمراض-الأمعاء-الالتهابية
&quot;حقوق الإنسان&quot; توعي الطلبة في 13 مركزا صيفيا,شاركت اللجنة الع مانية لحقوق الإنسان في البرنامج الصيفي لطلبة المدارس 2024م صيفي همم وقيم الذي نظمته وزارة التربية والتعليم من خلال محاضرات وحلقات عمل توعوية حول اختصاصاتها وآلي ,https://www.omandaily.om/omandaily/uploads/images/2024/07/30/2731082.jpeg,https://www.omandaily.om/عمان-اليوم/na/حقوق-الإنسان-توعي-الطلبة-في-13-مركزا-صيفيا
